{
  "claim_id": "dose_slope",
  "quantity_id": "dose_slope",
  "quantity": "Slope of the DiD outcome on standardized hearing engagement dose among opposition questioners (pp per within-committee SD).",
  "population": "Opposition-party legislator-ministry pairs present in both audits.",
  "period": "Cohorts 1 and 2 as in R25.",
  "comparison": "Per SD of hearing question dyads directed at the nominee.",
  "direction": "positive",
  "supporting_result": "Slope of at least +2.5pp per SD.",
  "decisive_metric": "Pooled slope and 95 percent interval, committee FE, SEs clustered by legislator.",
  "falsifying_result": "95 percent interval excludes +2.5pp per SD and includes zero, with 150 or more opposition units.",
  "threshold": 2.5,
  "units": "pp per SD",
  "equivalence_bound": 2.5,
  "claim_scope": "Intensity margin within the opposition only.",
  "supersedes": null,
  "kind": "prediction",
  "gap": {
    "gap_type": "c",
    "evidence": {
      "lit_a": {
        "doi": "10.1111/lsq.12440",
        "quoted_prediction": "Contrary to the conventional wisdom that confrontation crowds out information, we show that members of the president's party engage in less confrontational oversight and reveal no more or less information than their peers.",
        "location": "abstract",
        "quantity_match": "inferred"
      },
      "lit_b": {
        "doi": "10.18854/kpsr.2008.42.2.008",
        "quoted_prediction": null,
        "location": null,
        "quantity_match": "inferred"
      },
      "own_derivation": true
    }
  },
  "claims": [
    {
      "claim_id": "carryover_did",
      "quantity_id": "carryover_did",
      "quantity": "Opposed-minus-supportive difference-in-differences in the share of a legislator's audit question dyads directed at the confirmed nominee's ministry (percentage points).",
      "population": "Legislator-ministry pairs present in the same committee's audit before and after a minister-level confirmation hearing, 21st Assembly.",
      "period": "Cohort 1 hearings Dec 2020 to May 2021 (audits Oct 2020 and Oct 2021) and cohort 2 hearings May to Oct 2023 (audits Oct 2022 and Oct 2023).",
      "comparison": "Opposed vs supportive questioners, after minus before.",
      "direction": "positive",
      "supporting_result": "Pooled DiD of at least +5pp.",
      "decisive_metric": "Pooled DiD point estimate and 95 percent interval, committee FE, SEs clustered by legislator.",
      "falsifying_result": "95 percent interval excludes +5pp and includes zero, with placebo agencies showing the same before-after pattern.",
      "threshold": 5.0,
      "units": "pp",
      "equivalence_bound": 5.0,
      "claim_scope": "Audit allocation toward the confirmed ministry only, party-line opposition coding.",
      "supersedes": null
    }
  ],
  "spec_plan": [
    {
      "spec_id": "dose_pooled",
      "role": "primary",
      "outcome_def": "change in confirmed-ministry share",
      "sample_def": "opposition units, cohorts 1 and 2",
      "model": "OLS on standardized dose, committee FE, clustered by legislator",
      "expected_n": 138,
      "what_result_would_mean": "A slope below +2.5pp per SD would mean continuity fails at the intensity margin too."
    },
    {
      "spec_id": "dose_placebo",
      "role": "placebo",
      "outcome_def": "change in placebo-agency share",
      "sample_def": "opposition units, cohorts 1 and 2",
      "model": "OLS on standardized dose, committee FE, clustered by legislator",
      "expected_n": 138,
      "what_result_would_mean": "A dose slope on placebo agencies would mean the dose tilt is generic engagement, not ministry-directed."
    },
    {
      "spec_id": "cohort3_did",
      "role": "robustness",
      "claim_id": "carryover_did",
      "outcome_def": "change in confirmed-ministry share of audit question dyads",
      "sample_def": "cohort 3 (May 2022 nominees), nominating-president coding",
      "model": "OLS of the before-after change in share on opposed, committee FE, SEs clustered by legislator",
      "expected_n": 125,
      "what_result_would_mean": "A positive DiD under a government change would mean carry-over is regime-contingent."
    },
    {
      "spec_id": "sanity_permutation",
      "role": "sanity",
      "claim_id": "dose_slope",
      "sanity_kind": "permutation",
      "draws": 200,
      "outcome_def": "change in confirmed-ministry share, permuted within assembly term",
      "sample_def": "opposition units",
      "model": "OLS on standardized dose",
      "expected_n": null,
      "what_result_would_mean": "An estimate of similar size on permuted outcomes would mean the primary estimate is produced by the specification, not the data."
    },
    {
      "spec_id": "sanity_subsample",
      "role": "sanity",
      "claim_id": "dose_slope",
      "sanity_kind": "subsample",
      "draws": 50,
      "outcome_def": "change in confirmed-ministry share",
      "sample_def": "opposition units, 90 percent legislator subsamples",
      "model": "OLS on standardized dose",
      "expected_n": null,
      "what_result_would_mean": "A sign that flips across subsamples would mean a few legislators carry the estimate."
    }
  ]
}
