{
  "claim_id": "learning_interaction",
  "quantity_id": "ft_x_year_strict",
  "quantity": "first_term x proposal-year interaction in strict member-bill passage (pp per year).",
  "population": "Member bills, 17th-22nd Assemblies.",
  "period": "Proposal years 1-4 within each assembly.",
  "comparison": "First-term vs re-elected sponsors across proposal years.",
  "direction": "positive",
  "supporting_result": "Interaction that halves the year-1 gap by year 3 (+0.5 to +1.25pp per year).",
  "decisive_metric": "Pooled interaction and 95 percent interval with the within-year censoring control.",
  "falsifying_result": "Interaction indistinguishable from zero or negative.",
  "threshold": [
    0.5,
    1.25
  ],
  "units": "pp per year",
  "equivalence_bound": 0.5,
  "claim_scope": "Strict passage, pooled 17th-22nd.",
  "supersedes": null,
  "kind": "prediction",
  "gap": {
    "gap_type": "c",
    "evidence": {
      "lit_a": {
        "doi": "10.3162/036298006x201841",
        "quoted_prediction": "We found that effectiveness rises sharply with tenure, at least for the first few terms, even when we control for legislators' institutional positions, party affiliation, and other factors.",
        "location": "abstract",
        "quantity_match": "analogous"
      },
      "lit_b": {
        "doi": "10.18854/kpsr.2023.57.1.005",
        "quoted_prediction": null,
        "location": null,
        "quantity_match": "inferred"
      },
      "own_derivation": true
    }
  },
  "claims": [
    {
      "claim_id": "premise_gap",
      "quantity_id": "yr1_gap_strict",
      "quantity": "First-term minus re-elected strict passage rate among year-1 member bills (pp).",
      "population": "Member bills, 17th-22nd Assemblies.",
      "period": "Year-1 proposals of each assembly.",
      "comparison": "First-term vs re-elected sponsors.",
      "direction": "negative",
      "supporting_result": "Gap between -5 and -2pp.",
      "decisive_metric": "Adjusted year-1 gap and 95 percent interval.",
      "falsifying_result": "Interval excludes the -5 to -2pp range.",
      "threshold": [
        -5.0,
        -2.0
      ],
      "units": "pp",
      "equivalence_bound": 2.0,
      "claim_scope": "Direct passage (original or amended) only.",
      "supersedes": null
    }
  ],
  "spec_plan": [
    {
      "spec_id": "interaction_strict",
      "role": "primary",
      "outcome_def": "passed (original or amended)",
      "sample_def": "member bills 17th-22nd with committee",
      "model": "LPM passed ~ first_term x prop_year + assembly FE + bloc + election_type + committee FE, clustered by sponsor",
      "expected_n": 93000,
      "what_result_would_mean": "A zero or negative interaction would mean the learning prior is overturned."
    },
    {
      "spec_id": "interaction_12m",
      "role": "robustness",
      "outcome_def": "passed within 12 months",
      "sample_def": "member bills 17th-22nd with committee",
      "model": "LPM passed ~ first_term x prop_year + assembly FE + bloc + election_type + committee FE, clustered by sponsor",
      "expected_n": 93000,
      "what_result_would_mean": "A different sign on the 12-month outcome would mean censoring drives the headline."
    },
    {
      "spec_id": "interaction_absorption_incl",
      "role": "robustness",
      "outcome_def": "passed or absorbed into a committee alternative",
      "sample_def": "member bills 17th-22nd with committee",
      "model": "LPM passed ~ first_term x prop_year + assembly FE + bloc + election_type + committee FE, clustered by sponsor",
      "expected_n": 93000,
      "what_result_would_mean": "A different sign when absorption counts as success would mean the learning story depends on the outcome definition."
    },
    {
      "spec_id": "yr1_gap",
      "role": "robustness",
      "claim_id": "premise_gap",
      "outcome_def": "passed (original or amended)",
      "sample_def": "year-1 member bills",
      "model": "LPM with the same controls, year-1 bills only",
      "expected_n": 35000,
      "what_result_would_mean": "No year-1 gap would mean there is nothing for learning to close."
    },
    {
      "spec_id": "sanity_permutation",
      "role": "sanity",
      "claim_id": "learning_interaction",
      "sanity_kind": "permutation",
      "draws": 200,
      "outcome_def": "passed (original or amended), permuted within assembly term",
      "sample_def": "member bills 17th-22nd",
      "model": "LPM passed ~ first_term x prop_year + assembly FE + bloc + election_type + committee FE, clustered by sponsor",
      "expected_n": null,
      "what_result_would_mean": "An estimate of similar size on permuted outcomes would mean the primary estimate is produced by the specification, not the data."
    },
    {
      "spec_id": "sanity_subsample",
      "role": "sanity",
      "claim_id": "learning_interaction",
      "sanity_kind": "subsample",
      "draws": 50,
      "outcome_def": "passed (original or amended)",
      "sample_def": "member bills 17th-22nd, 90 percent legislator subsamples",
      "model": "LPM passed ~ first_term x prop_year + assembly FE + bloc + election_type + committee FE, clustered by sponsor",
      "expected_n": null,
      "what_result_would_mean": "A sign that flips across subsamples would mean a few legislators carry the estimate."
    }
  ]
}
